{
  "documentId": "knowledge-cand-comparison-principle-needs-retrieval-path",
  "documentType": "Knowledge",
  "schemaRef": "KnowledgeSchema/v5",
  "status": "ACTIVE",
  "content": {
    "title": {
      "blockType": "Title",
      "title": "比較・参照を伴う原則には取得経路が要ることを扱う概念：comparison-principle-needs-retrieval-path"
    },
    "principles": {
      "blockType": "Principles",
      "title": "原則",
      "items": [
        "比較を要求する原則は取得経路とセットで書く: 「既存の◯◯と比較する」という原則には、比較対象を実際にどこから・どうやって取得するかを、同じ原則内かそこから直接辿れる形で明記する。取得経路を欠いた比較原則は、読み手（AI）がその場しのぎに解釈するか、比較自体を省略しても気づかれない。",
        "静的な実例は動的な参照の代用にならない: 過去に得られた具体的な実証記録を文書内に埋め込んでおくことと、実行のたびに最新の実績を自動的に参照できる仕組みを持つことは別物である。前者は『一度そう確認された』という記録に過ぎず、後者が無ければ次回以降の実行はその記録を参照しない。",
        "複数consumerが共有するknowledgeほど取得経路の欠落に気づきにくい: 1つのadvisor・Skillだけが使うknowledgeなら、実行時にエラーとして表面化しやすい。複数のconsumerが同じ原則文を読んで各自の文脈で『良きに計らう』場合、誰も取得経路の欠落を検知しないまま運用され続ける。",
        "取得経路の具体化は、原則の対象領域に応じて実行環境側の既存の保存構造に委ねてよい（例: 確定済み成果物の保存場所を都度読み込む等）。ゼロから専用のログ機構を新設する必要はない。"
      ]
    },
    "classifications": {
      "blockType": "Classifications",
      "title": "分類",
      "items": [],
      "emptyReason": "この概念は「比較原則を書く際の着眼点」という単一の判断軸であり、種別に分かれる分類を持たない。"
    },
    "decisionCriteria": {
      "blockType": "DecisionCriteria",
      "title": "判断基準",
      "emptyReason": "分岐ではなく、原則の記述時・レビュー時に共通して確認する着眼点（取得経路の有無）1点に集約されるため、決定木を持たない。",
      "stages": [],
      "transitions": []
    },
    "examples": {
      "blockType": "Examples",
      "title": "実例",
      "text": "design-shareの敵対的測定（frontend-design-principles.md由来の8語のうち『理由を言い切る』）は、『比較の対象は自分自身の直近の出力も含める（似ていれば、その軸だけ意図的に変える）』と定めている。ところがこの『直近の出力』を実際にどこから取得して比較するかの手段が、frontend-design-principles.md自身にもdesign-share側の実行手順にも書かれていなかった。同文書に載っている実例（過去の自己比較ゲートの実証記録）も、過去のセッションで得られた3件の記録が文書内に静的に埋め込まれているだけで、新しい生成のたびに自動的に参照されるログにはなっていなかった。取得経路を明記するなら、例えば『確定済みのDESIGN.mdの保存場所（プロジェクトごとの.design-share/*/DESIGN.md）を都度読み込み、直近N件と比較する』という一文を原則に添えることで、この原則は初めて実行可能になる。"
    },
    "antiPatterns": {
      "blockType": "AntiPatterns",
      "title": "アンチパターン",
      "items": [
        {
          "name": "比較対象を明記しない比較原則",
          "problem": "「直近の出力と比較して変える」等と書きながら、直近の出力をどこから取得するかを書かない。読み手（AI）は毎回その場しのぎの解釈をするか、比較自体を省略する。原則が言明として存在するだけで、実行時には機能しない。"
        },
        {
          "name": "静的な実例を動的なログの代わりに使う",
          "problem": "文書内に埋め込まれた過去の実証件数を、以後の実行が自動的に参照するログだと誤認する。実際には次に生成する際、その実例は自動的に読み出されず、比較は行われない。"
        }
      ],
      "emptyReason": ""
    },
    "provenance": {
      "blockType": "Provenance",
      "title": "出典・根拠の透明性",
      "source": "design-shareの5平面ベース再設計（Jesse James Garrett『Elements of User Experience』準拠）の最終敵対的検証（2026-07-24、再現性レンズ）で発見した実例の抽象化。frontend-design-principles.mdの自己比較ゲート原則が、比較対象の取得手段を欠いたまま運用されていたことがきっかけ。",
      "caveats": "現時点で確認された実例は1件（frontend-design-principles.mdの自己比較ゲート）のみであり、evidence-based-scope（実例2件以上）は満たしていない。ただし、これは新しい能力の要否判断ではなく、既存の原則記述パターンに内在する論理的な欠陥（比較を要求しながら取得経路を欠く）を正確にモデル化したものであり、実例数の多寡に関わらず今回の1件だけで十分に成立する指摘である。今後、同種の実例が他のknowledge文書でも見つかった場合は、この文書のexamplesへ追記して補強する。"
    },
    "relatedConcepts": {
      "blockType": "RelatedConcepts",
      "title": "関連概念",
      "items": [
        {
          "conceptId": "frontend-design-principles",
          "note": "取得経路を欠いた比較原則（自己比較ゲート）の実例そのもの"
        }
      ],
      "emptyReason": ""
    },
    "description": {
      "blockType": "Overview",
      "title": "概要",
      "questions": [
        "「既存の◯◯と比較する」「過去の△△と照らす」という原則を書くとき、何を明記しないと実行不能になるか",
        "比較対象の取得経路が無い原則を、どう見分ければよいか",
        "文書内に埋め込まれた静的な実例と、実行のたびに参照される動的なログは何が違うか"
      ],
      "text": "advisorのバックボーンknowledgeに『既存の何かと比較して、似ていれば変える』という趣旨の原則を書くとき、比較対象を実際にどこから・どうやって取得するかを明記しない限り、その原則は言明として存在するだけで実行時には参照先を持たない。この概念は、比較・参照を要求する原則を書く・レビューする際に、取得経路の有無を確認するための着眼点を扱う。"
    }
  },
  "tags": [],
  "skillRefs": [
    "ux-advisor"
  ],
  "knowledgeKind": "process",
  "agentRefs": [
    "waffle"
  ]
}
