{
  "documentId": "self-improving-generation-cycle",
  "documentType": "Knowledge",
  "schemaRef": "KnowledgeSchema/v5",
  "status": "ACTIVE",
  "content": {
    "title": {
      "blockType": "Title",
      "title": "生成物の質を継続的に改善するサイクルを扱う概念：self-improving-generation-cycle"
    },
    "principles": {
      "blockType": "Principles",
      "title": "原則",
      "items": [
        "生成だけでは成果物の質は保証されない: 生成した成果物を独立した目で測定し、欠陥をfixし、fix後は必ず再測定してから確定とする。fixした本人の自己申告を、検証なしに確定にしない。",
        "測定は層で分け、上位層が壊れていれば下位層は測定しない: 意図・構造に関わる層（例: 判断の出どころが正しいか）が壊れていれば、実装の精度（例: 見た目の細部）をどれだけ磨いても無駄なコストになる。層の順序は下流が上流に依存する向きに揃える。",
        "還元は答えでなく意図と反例として書く: サイクルで見つかった欠陥を知識へ書き戻す時、具体の値・個数・手順として固定すると、次のサイクルの表現を縛る。「何を避けるべきか」「なぜそれが問題か」だけを書き、答えは題材ごとに委ねる。",
        "サイクルは複利で効く: 各サイクルの学びが知識に積み上がるほど、次のサイクルはより高い床から始まる。後戻りしない（ラチェット）。工場化（自動テンプレ・機械ゲートのみへの置き換え）は、この複利を壊す——判断が自動化に吸収されると、何が既定値でありきたりかを見分ける力そのものが失われる。",
        "自動測定には死角がある: 生成者自身による自己検証・機械的な照合だけでは検出できない欠陥がある。独立した目（別人格の批評、実機・実環境での確認等）を経路として残す。",
        "抽象化は実例が積み上がってから行う: 1つの領域での成功だけでこの概念自体を一般則として確定しない。独立した2つ以上の領域で同型のサイクルが機能して初めて、横断的な概念として書いてよい。"
      ]
    },
    "classifications": {
      "blockType": "Classifications",
      "title": "分類",
      "items": [
        {
          "name": "生成",
          "description": "題材・要件に基づいて成果物の初版を作る段階。"
        },
        {
          "name": "層状ゲート測定",
          "description": "独立した目で、意図・構造・実装精度の順に測定する段階。上位層のFAILは下位層の測定を止める。"
        },
        {
          "name": "修正",
          "description": "見つかった欠陥をfixし、fixした層から必ず再測定する段階。"
        },
        {
          "name": "還元",
          "description": "サイクルで得た学びを、意図と反例の形で知識へ書き戻す段階。次のサイクルの床を上げる。"
        }
      ],
      "emptyReason": ""
    },
    "decisionCriteria": {
      "blockType": "DecisionCriteria",
      "title": "判断基準",
      "emptyReason": "生成対象を問わず同じ4段階サイクルが適用されるため、分岐する判断フローを持たない。",
      "stages": [],
      "transitions": []
    },
    "examples": {
      "blockType": "Examples",
      "title": "実例",
      "text": "このwaffleプロジェクト自身が、独立した2つの領域で同型のサイクルを実際に運用している。領域A（UIモック生成・design-share Skill）: 生成→3層直列ゲート測定（①コンセプト＝題材に根ざしているか→②レイアウト＝情報設計が妥当か→③デザイン＝視覚クラフト/CSS技術品質）→修正→frontend-design-principles.mdへ反例として還元。1つの商用モックを仕上げる過程で、fixしたはずの欠陥が実は未反映だった（生成者の自己申告を鵜呑みにした）ケースが複数回発生し、「fix後は必ずその層から再測定する」という原則がここから確立した。領域B（spec-authoring・Orchestratorの運用ルール）: spec下書き→check-spec-integrity/check-scenario-drift（層状ゲート）＋ddd-advisor/tech-lead-advisorの並列批評（測定）→修正→knowledge-cultivatorによる人間審査を経た正式知識への昇格（還元）。この2領域は互いを参照せずに独立して同じ骨格に収束しており、この骨格が題材固有でなく汎用の構造であることを裏づけている。"
    },
    "antiPatterns": {
      "blockType": "AntiPatterns",
      "title": "アンチパターン",
      "items": [
        {
          "name": "一発生成で確定する",
          "problem": "生成した成果物を測定なしに確定とすると、生成者自身が見落とした欠陥がそのまま出荷される"
        },
        {
          "name": "fixの自己申告を検証なしに信じる",
          "problem": "「直したはず」を生成者本人の申告のまま確定にすると、実際には反映されていない修正が見過ごされる（本セッションで複数回実際に発生した）"
        },
        {
          "name": "層を潰して一括測定する",
          "problem": "意図・構造・実装精度を同時に1回で測定すると、上位層の重大な欠陥が下位層の指摘に埋もれて見えなくなる。逆に、上位層が壊れているのに下位層の細部を磨くコストを払ってしまう"
        },
        {
          "name": "還元時に具体の答えを固定する",
          "problem": "学びを「常にこの値・この個数・この手順で」と書くと、次のサイクルの表現の自由を奪い、題材によらず同じ出力に収束するハウススタイル化を招く"
        },
        {
          "name": "工場化（自動テンプレ・機械ゲートのみへの置き換え）",
          "problem": "判断（ありきたりでないか等の質的な見極め）を自動化に完全に譲ると、機械は『壊れていないか』しか見られなくなり、質の低い既定値への収束を検出できなくなる"
        },
        {
          "name": "独立した検証経路を持たない",
          "problem": "生成者自身による自己検証だけに頼ると、自己検証自体の死角（本人には見えない前提・癖）が検出されない。実機確認・別人格の批評など、生成者の外にある検証経路が要る"
        }
      ],
      "emptyReason": ""
    },
    "provenance": {
      "blockType": "Provenance",
      "title": "出典・根拠の透明性",
      "source": "design-share Skill（UIモック生成）の標準サイクル運用と、spec-authoring/Orchestratorの既存運用ルール（check-spec-integrity・check-scenario-drift・advisor並列批評・knowledge-cultivator）という、本プロジェクト内の独立した2実例からの抽象化。外部文献の引用ではない。",
      "caveats": "実例は本プロジェクト内の2領域（デザイン生成・spec執筆）に限られる。coding/implementation領域での同型サイクルの運用は、このsheetの執筆時点では試験観測のみで実例として確定していない（ReportFindingsの階層批評・4層テストが構造的に類似すると見立てているが、サイクルとして明示的に運用された実例ではまだない）。第3領域での実例確認により、この一般化の確度はさらに上がる。"
    },
    "relatedConcepts": {
      "blockType": "RelatedConcepts",
      "title": "関連概念",
      "items": [
        {
          "conceptId": "frontend-design-principles",
          "note": "領域A（design-share）でのこのサイクルの具体運用。考え・実例・流行の3層分離もこの概念の還元原則と同型"
        },
        {
          "conceptId": "evidence-based-scope",
          "note": "抽象化は実例2件以上を経てから行う、という原則の出典。この概念シート自体もこの基準を満たしてから執筆した"
        },
        {
          "conceptId": "closing-heuristics",
          "note": "サイクルの区切り（いつ確定とするか）の判断に関連しうる基礎概念"
        }
      ],
      "emptyReason": ""
    },
    "description": {
      "blockType": "Overview",
      "title": "概要",
      "questions": [
        "生成物の質を、単発の生成でなくどう継続的に高めるべきか",
        "測定は一括で行うべきか、層に分けるべきか",
        "サイクルで得た学びを知識へどう書き戻すべきか（具体の答えを書いてよいか）",
        "このサイクルは特定の生成対象（デザイン等）に固有か、それとも他の生成対象にも一般化できるか",
        "自動化・テンプレ化でこのサイクルを置き換えてよいか"
      ],
      "text": "生成物（デザイン・仕様・実装など）の質を、生成の瞬間の一発勝負でなく、〈生成→層状ゲート測定→修正→知識への還元〉というサイクルの反復で高めていく考え方。各サイクルの学びが知識に積み上がり、次のサイクルはより高い床から始まる。自動化・テンプレ化（工場）による置き換えではなく、判断をループの中に残すことで複利が効く。"
    }
  },
  "tags": [
    "framework:process",
    "domain:quality"
  ],
  "skillRefs": [],
  "knowledgeKind": "process",
  "agentRefs": [
    "waffle"
  ]
}
