{
  "documentId": "evolving-design",
  "documentType": "Knowledge",
  "schemaRef": "KnowledgeSchema/v5",
  "status": "ACTIVE",
  "content": {
    "title": {
      "blockType": "Title",
      "title": "設計を継続的に進化させる原則を扱う概念：evolving-design"
    },
    "principles": {
      "blockType": "Principles",
      "title": "原則",
      "items": [
        "DDDにおける設計は、一度確定させて終わりのものではない。",
        "事業活動・組織・業務知識・システムの成長という複数の変化のベクトルに応じて、継続的に見直されるべきものである。",
        "よい設計とは「今の状況に対して適切な設計」であって、将来のあらゆる変化を先読みして作り込む設計ではない。",
        "変化を恐れて設計を凍結すると、モデルは徐々に実態と乖離し、変更のたびに危険を伴うようになる。",
        "同時に、変化への対応を急ぎすぎるのも誤りである。",
        "重要なのは「変化にどう対応するか」よりも先に「変化の兆候をどう検知するか」であり、まだ現れていない変化を先回りして複雑な設計を持ち込むことは、それ自体が不必要な複雑さの原因になる。"
      ]
    },
    "classifications": {
      "blockType": "Classifications",
      "title": "分類",
      "items": [
        {
          "name": "業務領域カテゴリーの変化",
          "description": "中核/一般/補完は差別化の源泉になっているか・複雑さに見合う収益があるかを軸に双方向に変化しうる。"
        },
        {
          "name": "実装方法の変化",
          "description": "業務ロジックの複雑さの増大に応じて、単純なデータ操作中心の実装からドメインモデルへ段階的に移行する。"
        },
        {
          "name": "組織の変化",
          "description": "チーム間の距離の変化に応じて、コンテキスト間の連係方式(緊密な協力/供給者・利用者/互いに独立)を見直す。"
        },
        {
          "name": "業務知識の蓄積",
          "description": "知識が少ない段階では境界を広めに引き、知識が蓄積したら小さい単位に分解する。"
        },
        {
          "name": "システムの成長",
          "description": "同じデータ集合を操作する一連のユースケースに注目し、業務領域・コンテキスト・集約の境界を再検討する。"
        }
      ],
      "emptyReason": ""
    },
    "decisionCriteria": {
      "blockType": "DecisionCriteria",
      "title": "判断基準",
      "stages": [
        {
          "id": "q1",
          "label": "業務領域のカテゴリー(中核/一般/補完)は不変か"
        },
        {
          "id": "q2",
          "label": "カテゴリーが変わったら何を見直すべきか"
        },
        {
          "id": "q3",
          "label": "実装方法(コードの内部構造)はいつ、どちらの方向に移行すべきか"
        },
        {
          "id": "q4",
          "label": "組織の変更にはどう対応するか"
        },
        {
          "id": "q5",
          "label": "業務知識が少ない段階と蓄積した段階とで、境界の引き方はどう変えるべきか"
        },
        {
          "id": "q6",
          "label": "システムが成長したら何を見直すべきか"
        },
        {
          "id": "r1",
          "label": "不変ではない。差別化の源泉になっているか・複雑さに見合う収益があるかを軸に双方向に変化しうる"
        },
        {
          "id": "r2",
          "label": "コンテキスト間の連係方法と開発戦略(内製か外部委託か)を見直す"
        },
        {
          "id": "r3",
          "label": "単純な実装(データ操作中心)から、より構造化されたドメインモデルへ段階的に移行する"
        },
        {
          "id": "r4",
          "label": "兆候が現れる前に先回りして移行する必要はない"
        },
        {
          "id": "r5",
          "label": "より疎な連係方式(緊密な協力関係→供給者/利用者→互いに独立)へ移行する"
        },
        {
          "id": "r6",
          "label": "より緊密な連係へ戻すことも選択肢になる"
        },
        {
          "id": "r7",
          "label": "境界をやや広めに引いておく方が安全"
        },
        {
          "id": "r8",
          "label": "その知識を使って広い境界をより小さい単位に分解することを検討する"
        },
        {
          "id": "r9",
          "label": "同じデータ集合を操作する一連のユースケースに注目し、業務領域・コンテキスト・集約の境界を再検討する(純度の高い中核領域の抽出)"
        }
      ],
      "transitions": [
        {
          "from": "q1",
          "to": "r1",
          "label": "常に(不変ではない)"
        },
        {
          "from": "r1",
          "to": "q2",
          "label": "カテゴリーが実際に変化した場合"
        },
        {
          "from": "q2",
          "to": "r2",
          "label": "カテゴリーが変わった場合"
        },
        {
          "from": "q3",
          "to": "r3",
          "label": "データ構造が込み入ってきた・ロジックの重複や不整合が増えてきた・変更が危険で読みにくくなってきた、という兆候が現れたとき"
        },
        {
          "from": "q3",
          "to": "r4",
          "label": "まだ複雑さの兆候が現れていないとき"
        },
        {
          "from": "q4",
          "to": "r5",
          "label": "チーム間の物理的・組織的な距離が広がり、意図の伝達がうまくいかなくなった"
        },
        {
          "from": "q4",
          "to": "r6",
          "label": "チーム間の距離が縮まった"
        },
        {
          "from": "q5",
          "to": "r7",
          "label": "業務知識が少ないうち"
        },
        {
          "from": "q5",
          "to": "r8",
          "label": "業務知識が蓄積してきたら"
        },
        {
          "from": "q6",
          "to": "r9",
          "label": "システムが成長し複雑になったとき"
        }
      ],
      "emptyReason": ""
    },
    "examples": {
      "blockType": "Examples",
      "title": "実例",
      "text": "最初のFoliostoreは、書籍を自社在庫として仕入れて販売するだけの単一事業者だった。「配送」は自社倉庫からの発送のみ、「価格」は自社が決める定価のみを意味していた。事業拡大に伴い、Foliostoreは複数の出品者(サードパーティ)が自分の書籍を出品できるマーケットプレイスへと進化する。ここで「配送」「価格」の意味が二重化し、当初は自社完結の一般的なオペレーション(在庫管理)だった部分が、出品者との連係を仲介する新しい中核的関心事(マーケットプレイス基盤)へと育っていった。当初、注文処理は単純なデータ操作で足りていたが、出品者ごとの手数料計算・在庫引当ロジック・返品時の返金按分など業務ルールが積み上がるにつれ、データの不整合とロジックの重複が目立つようになり、注文まわりのロジックは不変な値を表現するオブジェクトと集約(注文)を中心にしたドメインモデルへと段階的に移行された。マーケットプレイス化に伴い出品者向け機能を担当する新しいチームが立ち上がり、当初は緊密に協力していた両チームだったが開発のリズムがずれ始めたため、「出品者向けAPI」という明示的な連係点を挟み、供給者・利用者の関係へと連係方法を見直した。事業拡大の初期段階では「出品者管理」も「注文管理」も一つの広いコンテキストとして扱っていたが、業務知識が蓄積し出品者の与信審査・契約管理という関心事が明確になった段階で、別のコンテキストとして切り出した。サービス規模が拡大するにつれ「注文」集約が配送状況・レビュー・在庫予約まで抱え込むようになり肥大化したため、同じデータ集合を操作するユースケースを洗い出した結果、「在庫予約」は独立した集約として切り出され、「注文」集約は本来の関心事(注文の成立と支払い)に絞り込まれた。"
    },
    "antiPatterns": {
      "blockType": "AntiPatterns",
      "title": "アンチパターン",
      "items": [
        {
          "name": "カテゴリーが変わっても設計を変えない",
          "problem": "中核が一般化したのに社内開発体制を維持し続けたり、補完が中核化したのに単純な実装のまま放置したりすると、競争力の獲得やコスト最適化の機会を失う。"
        },
        {
          "name": "業務知識が少ない段階で境界を細かく切りすぎる",
          "problem": "業務の輪郭がまだはっきりしないうちに細かい境界を引くと、後から間違いに気づいて引き直すコストが、実装済みの物理的な境界を割り直すコストとして跳ね返ってくる。最初は広めに境界を引き、知識が増えてから分割する方が安全である。"
        },
        {
          "name": "成長に応じた境界の再検討を怠る",
          "problem": "集約やコンテキストが「何にでも手を出して、どれも中途半端」な状態のまま放置される。定期的に「同じデータを操作する一連のユースケース」を洗い出し境界を再点検する必要がある。"
        },
        {
          "name": "実装方法の移行を、兆候が現れる前に先回りでやってしまう",
          "problem": "まだ複雑さの兆候が現れていないのに最初から高度に構造化された実装を採用すると、不必要な複雑さを事前に持ち込むことになる。移行は兆候が現れてから行う方がよい。"
        }
      ],
      "emptyReason": ""
    },
    "provenance": {
      "blockType": "Provenance",
      "title": "出典・根拠の透明性",
      "source": "本ファイルの「原則」「判断の分岐点」「アンチパターン」は、『ドメイン駆動設計をはじめよう』第11章が扱う一般原則(業務領域カテゴリーの変化・実装方法の見直し・組織変更・業務知識・システムの成長という複数の変化のベクトル)を要約・再構成したものであり、本文の直接引用ではない。書籍固有の企業例・逸話・図版は用いず、教材専用の架空ドメイン(オンライン書店からマーケットプレイスへの進化)に置き換えている。",
      "caveats": ""
    },
    "relatedConcepts": {
      "blockType": "RelatedConcepts",
      "title": "関連概念",
      "items": [
        {
          "conceptId": "subdomain",
          "note": "業務領域のカテゴリー(中核・一般・補完)とその変化"
        },
        {
          "conceptId": "bounded-context",
          "note": "区切られた文脈の設計と境界の見直し"
        },
        {
          "conceptId": "context-integration",
          "note": "カテゴリー変化・組織変更に伴う連係方法の見直し"
        },
        {
          "conceptId": "design-heuristics",
          "note": "業務ロジックの実装方法の選択に関する経験則"
        }
      ],
      "emptyReason": ""
    },
    "description": {
      "blockType": "Overview",
      "title": "概要",
      "questions": [
        "業務領域のカテゴリー(中核/一般/補完)は最初に決めたら固定なのか、それとも事業の変化に応じて見直すべきか",
        "実装方法(単純なデータ操作中心の実装から、より構造化されたドメインモデルへ、等)は、いつ・どちらの方向に移行すべきか",
        "組織やチーム構成が変わったとき、コンテキスト間の連係方法をどう見直すべきか",
        "業務知識が乏しい初期段階と、知識が蓄積した段階とで、境界の引き方はどう変えるべきか",
        "システムが成長して複雑になってきたとき、何を見直すべきか"
      ],
      "text": "DDDにおける設計は一度確定させて終わりのものではなく、事業活動・組織・業務知識・システムの成長という複数の変化のベクトルに応じて継続的に見直されるべきものである。"
    }
  },
  "tags": [],
  "skillRefs": [
    "ddd-advisor"
  ],
  "knowledgeKind": "domain"
}
